Words (split by space),anger,disgust,fear,joy,sad,surprise
cohn gunman jailed for years,0.08695995799855102,0.0680975380511229,0.17816022788629288,0.23535574916345647,0.20247774546802494,0.2289487814325516
bill would strip convicted legislators of pensions,0.0774409209415284,0.08023543486815415,0.14746144616642004,0.2347846159174144,0.24288011935214113,0.21719746275434168
amish killings school demolished,0.0712003977785882,0.06771787831025393,0.23106848878175604,0.14762990862382852,0.22598013978203974,0.2564031867235338
flooding washes out road to valdez alaska,0.1587470372624147,0.03866526416568426,0.24464111217312004,0.2210302938286238,0.11846752652952396,0.21844876604063343
russian bird flu outbreak is deadly asian strain,0.04612239010601727,0.045072832001806014,0.2883173819283831,0.17828387180245292,0.2095097229753943,0.23269380118594626
